id,rank,name,genus,species,authors,author_ids,year,status,citation_micro,citation_full,citation_id,publication_id,basionym_id,type_id,ipni_id,wfo_id,gbif_id,indexfungorum_id,note
99ae0dec-9bad-11eb-a8a2-19ed5c03f8d3,genus,Dihyphis,,,Locq.,,,,"Actes du 1100<sup>e</sup> Congrès National des Sociétés Savantes, Montpellier 1985 (Paris), Section des Sciences. Fasc. V. Paléobotanique 28 (1985)",,,,99ae0dec-9bad-11eb-a8a2-19ed5c03f8d3,,,,,25857," "
37781ea2-9bac-11eb-a8a2-19ed5c03f8d3,species,parallelis,Dihyphis,,Locq.,,,,"Actes du 1100<sup>e</sup> Congrès National des Sociétés Savantes, Montpellier 1985 (Paris), Section des Sciences. Fasc. V. Paléobotanique 28 + pl. II, fig. 3 (1985)",,,,37781ea2-9bac-11eb-a8a2-19ed5c03f8d3,,,,,130332," "
8087f580-8fcd-11eb-924d-9cd76263cbd0,species,preussii,Dikylikostigma,,Kraenzl.,,1919,,"Notizbl. Bot. Gart. Berlin-Dahlem 7: 321 1919",,Q55776818,,,,80367-2,wfo-0000943433,2820741,,
fcd88c80-8fcd-11eb-924d-9cd76263cbd0,species,lyelii,Dilaena,,"(Hook.) Dumort.",,1822,,"Comment. Bot. 1: 317 1822",,,,,,,wfo-0001210065,7632007,,
fcd8a8dc-8fcd-11eb-924d-9cd76263cbd0,variety,lamellata,Dilaena,lyellii,Nees,,1838,,"Naturgesch. Eur. Leberm. 3: 345 1838",,,,,,,wfo-0001210066,8268966,,
