id,rank,name,genus,species,authors,author_ids,year,status,citation_micro,citation_full,citation_id,publication_id,basionym_id,type_id,ipni_id,wfo_id,gbif_id,indexfungorum_id,note
a3ffc9ca-9bad-11eb-a8a2-19ed5c03f8d3,genus,Neotrotteria,,,Sacc.,Q707840,1921,,"Bulletino dell'orto Botanico della R. Universitá di Napoli 6: 45 (1921)",,,,a3ffc9ca-9bad-11eb-a8a2-19ed5c03f8d3,,,,,3487," "
2b81fa6e-9bac-11eb-a8a2-19ed5c03f8d3,species,lobayensis,Neotrotteria,,Saccas,,1981,invalid,"Étude de la Flore Cryptogamique des Caféirs en Afrique Centrale, (Bulletin IFCC <b>16</b>) 16: 319 (1981)",,,,2b81fa6e-9bac-11eb-a8a2-19ed5c03f8d3,,,,,112476,"Nom. inval., Art. 37.1 "
2b0a96f4-9bac-11eb-a8a2-19ed5c03f8d3,species,mangiferae,Neotrotteria,,Vaidya,,1981,,"Curr. Sci. 50(20): 901 (1981)",,,,2b0a96f4-9bac-11eb-a8a2-19ed5c03f8d3,,,,,111693," "
fce93798-9bac-11eb-a8a2-19ed5c03f8d3,species,nigrosetosa,Neotrotteria,,Saccas,,1954,,"J. Agric. Trop. Bot. Appl. 1: 344 (1954)",,,,fce93798-9bac-11eb-a8a2-19ed5c03f8d3,,,,,301827," "
e2318c8e-9bac-11eb-a8a2-19ed5c03f8d3,species,pulchella,Neotrotteria,,Sacc.,Q707840,1918,,"Bulletino dell'orto Botanico della R. Universitá di Napoli 6: 45 (1918)",,,,e2318c8e-9bac-11eb-a8a2-19ed5c03f8d3,,,,,275598," "
