id,rank,name,genus,species,authors,author_ids,year,status,citation_micro,citation_full,citation_id,publication_id,basionym_id,type_id,ipni_id,wfo_id,gbif_id,indexfungorum_id,note
5581c816-9bad-11eb-a8a2-19ed5c03f8d3,genus,Yoshinagella,,,Höhn.,,1913,,"Sber. Akad. Wiss. Wien, Math.-naturw. Kl., Abt. 1 122: 293 (1913)",,,,5581c816-9bad-11eb-a8a2-19ed5c03f8d3,,,,,5860," "
a5376c2c-9bac-11eb-a8a2-19ed5c03f8d3,species,japonica,Yoshinagella,,Höhn.,,1913,,"Fragm. Mykol. 122: no. 804 (1913)",,,,a5376c2c-9bac-11eb-a8a2-19ed5c03f8d3,,,,,248507," "
534d34dc-9bac-11eb-a8a2-19ed5c03f8d3,species,nuda,Yoshinagella,,"F. Stevens",,1925,,"Bulletin of the Bernice P. Bishop Museum, Honolulu, Hawaii 19: 16 (1925)",,,,534d34dc-9bac-11eb-a8a2-19ed5c03f8d3,,,,,248490," "
091eab60-9bad-11eb-a8a2-19ed5c03f8d3,species,phyllostachydis,Yoshinagella,,"I. Hino & Katum.",,1954,,"Bulletin of the Faculty of Agriculture, Yamaguchi University 5: 232 (1954)",,,,091eab60-9bad-11eb-a8a2-19ed5c03f8d3,,,,,308015," "
11ad102e-9bac-11eb-a8a2-19ed5c03f8d3,species,polymorpha,Yoshinagella,,"Lyon ex F. Stevens",,1925,,"in Stevens, Bulletin of the Bernice P. Bishop Museum, Honolulu, Hawaii 19: 14 (1925)",,,,11ad102e-9bac-11eb-a8a2-19ed5c03f8d3,,,,,248915," "
b252f42a-9bad-11eb-a8a2-19ed5c03f8d3,variety,pauciseta,Yoshinagella,polymorpha,"F. Stevens",,1925,,"Bulletin of the Bernice P. Bishop Museum, Honolulu, Hawaii 19: 16 (1925)",,,,b252f42a-9bad-11eb-a8a2-19ed5c03f8d3,,,,,139349," "
b480e94c-9bac-11eb-a8a2-19ed5c03f8d3,variety,polymorpha,Yoshinagella,polymorpha,"Lyon ex F. Stevens",,1925,,"in Stevens, Bulletin of the Bernice P. Bishop Museum, Honolulu, Hawaii 19: 14 (1925)",,,,b480e94c-9bac-11eb-a8a2-19ed5c03f8d3,,,,,421421," "
