id,rank,name,genus,species,authors,year,citation_micro,citation_full,citation_id,publication_id,basionym_id,ipni_id,wfo_id,gbif_id,note
e5a36266-8fd1-11eb-924d-9cd76263cbd0,genus,Lebrunia,,,Staner,,"Bull. Jard. Bot. État Bruxelles 13: 105. 1934.",,,,,19358-1,wfo-4000020819,3231112,
2aef603c-8fcc-11eb-924d-9cd76263cbd0,species,busbaie,Lebrunia,,Staner,,"Bull. Jard. Bot. État 13: 105 1934",,,,,428728-1,wfo-0000359066,8230302,
ac4ca2ba-8fcd-11eb-924d-9cd76263cbd0,species,bushaei,Lebrunia,,Staner,,"Bull. Jard. Bot. État Brux. 13: 105 1934",,,,,,wfo-0001035312,7408655,
ec2f0988-8fcb-11eb-924d-9cd76263cbd0,species,lebrunii,,,E.G.Camus,,"Bull. Soc. Bot. France 38: 351 1891",,,,,648181-1,wfo-0000258807,,
7d57c296-8fcd-11eb-924d-9cd76263cbd0,species,lebrunii,,,"(E.G.Camus) Peitz",,"Jahresber. Naturwiss. Vereins Wuppertal 25: 190 1972",,,,,941846-1,wfo-0000936374,,
7d5ae516-8fcd-11eb-924d-9cd76263cbd0,species,lebrunii,,,"(E.G.Camus) Soó",,"Ann. Univ. Sci. Budapest. Rolando Eötvös, Sect. Biol. 8: 318 1966",,,,,626523-1,wfo-0000936402,,
