id,rank,name,genus,species,authors,author_ids,year,status,citation_micro,citation_full,citation_id,publication_id,basionym_id,type_id,ipni_id,wfo_id,gbif_id,indexfungorum_id,note
a23d7cae-9bad-11eb-a8a2-19ed5c03f8d3,genus,Colloderma,,,"G. Lister",,1910,,"J. Bot., London 48: 312 (1910)",,,,a23d7cae-9bad-11eb-a8a2-19ed5c03f8d3,,,,,12048," "
2885e7a8-9bac-11eb-a8a2-19ed5c03f8d3,species,crassipes,Colloderma,,Rammeloo,,1983,,"Bull. Jard. Bot. Nat. Belg. 53(1/2): 297 (1983)",,,,2885e7a8-9bac-11eb-a8a2-19ed5c03f8d3,,,,,107826," "
d901f4e6-9bac-11eb-a8a2-19ed5c03f8d3,species,dubium,Colloderma,,Krzemien.,,1934,,"Acta Soc. Bot. Pol. 11: 125 (1934)",,,,d901f4e6-9bac-11eb-a8a2-19ed5c03f8d3,,,,,263572," "
b162acf4-9bad-11eb-a8a2-19ed5c03f8d3,species,macrotubulatum,Colloderma,,"Nann.-Bremek. & Lado",,1985,,"Proc. K. Ned. Akad. Wet., Ser. C, Biol. Med. Sci. 88(2): 222 (1985)",,,,b162acf4-9bad-11eb-a8a2-19ed5c03f8d3,,,,,107409," "
7ebf39b2-9bac-11eb-a8a2-19ed5c03f8d3,species,oculatum,Colloderma,,"(C. Lippert) G. Lister",,1910,,"Taxonomie und medizinische Bedeutung der zur Gattung Geotrichum Link gehorenden Arten (Med. Habil.-Schrift, Magdeburg) 48: 312 (1910)",,,,7a61d658-9bad-11eb-a8a2-19ed5c03f8d3,,,,,172207," "
dffa7d54-9bac-11eb-a8a2-19ed5c03f8d3,variety,castaneum,Colloderma,oculatum,Krzemien.,,1934,,"Acta Soc. Bot. Pol. 11: 123 (1934)",,,,dffa7d54-9bac-11eb-a8a2-19ed5c03f8d3,,,,,272734," "
c1df545c-9bac-11eb-a8a2-19ed5c03f8d3,variety,oculatum,Colloderma,oculatum,"(C. Lippert) G. Lister",,1910,,"Taxonomie und medizinische Bedeutung der zur Gattung Geotrichum Link gehorenden Arten (Med. Habil.-Schrift, Magdeburg) 48: 312 (1910)",,,,c1df545c-9bac-11eb-a8a2-19ed5c03f8d3,,,,,425217," "
e2e29b3c-9bac-11eb-a8a2-19ed5c03f8d3,species,robustum,Colloderma,,Meyl.,,1933,,"Diagn. Mycoth. Univ. Cent. 57: 83 (1933)",,,,e2e29b3c-9bac-11eb-a8a2-19ed5c03f8d3,,,,,276656," "
