id,rank,name,genus,species,authors,year,citation_micro,citation_full,citation_id,publication_id,basionym_id,ipni_id,wfo_id,gbif_id,note
e39f6708-8fd1-11eb-924d-9cd76263cbd0,genus,Evodianthus,,,Oerst.,,"Vidensk. Meddel. Dansk Naturhist. Foren. Kjøbenhavn 194. 1857.",,,,,13544-1,wfo-4000014403,2861088,
23b765d4-8fcd-11eb-924d-9cd76263cbd0,species,angustifolius,Evodianthus,,Oerst.,,"Vidensk. Meddel. Naturhist. Foren. Kjøbenhavn 1857: 195 1857",,,,,297678-1,wfo-0000767141,2861094,
23b78212-8fcd-11eb-924d-9cd76263cbd0,species,freyreissii,Evodianthus,,Lindm.,,"Bih. Kongl. Svenska Vetensk.-Akad. Handl. 26(8): 9 1900",,,,,102547-2,wfo-0000767142,2861099,
23b79b8a-8fcd-11eb-924d-9cd76263cbd0,species,funifer,Evodianthus,,"(Poit.) Lindm.",,"Bih. Kongl. Svenska Vetensk.-Akad. Handl. 26(8): 8 1900",,,,,102548-2,wfo-0000767143,2861089,
23b803ea-8fcd-11eb-924d-9cd76263cbd0,subspecies,trailianus,Evodianthus,funifer,"(Drude) Harling",,"Acta Horti Berg. 18: 271 1958",,,,,102551-2,wfo-0000767147,2861104,
